{
  "kind": "cancel_rule",
  "id": "undertow",
  "name": "Undertow",
  "status": "proposed",
  "source": "kappa",
  "offered_by": "elder-kappa",
  "rarity": "rare",
  "locked": true,
  "rules": [
    "X1",
    "X2",
    "X3",
    "X4",
    "A9",
    "A8",
    "A12",
    "C4",
    "E12"
  ],
  "path": {
    "from": "successful_throws",
    "into": "one_special",
    "on": [
      "hit"
    ]
  },
  "once_per_combo": true,
  "card": {
    "plain": "After a successful throw, cancel into a special.",
    "frames": "Landed throw → one special, once per combo"
  },
  "notes": "GDD example: River Grab -> Shell Spin while the opponent is rising. Throw stays generic (C4); a landed throw counts as a hit."
}
