{
  "kind": "cancel_rule",
  "id": "fox-step",
  "name": "Fox Step",
  "status": "proposed",
  "source": "kitsune",
  "offered_by": "nine-tailed-kitsune",
  "rarity": "rare",
  "locked": false,
  "rules": [
    "X1",
    "X2",
    "X3",
    "X4",
    "A9",
    "A8",
    "A12"
  ],
  "path": {
    "from": "specials",
    "into": "dash",
    "on": [
      "hit",
      "block",
      "whiff"
    ]
  },
  "once_per_combo": true,
  "card": {
    "plain": "Cancel any special into a dash.",
    "frames": "Special → dash inside the move's cancel window, once per combo"
  },
  "notes": "Promoted from data/samples/fox-step.json. Cancel windows come from each move's clip-derived data. Whiff included as the sample had it; designer to confirm."
}
